{
  "tenantId": "t_rd_003",
  "username": "royaldental",
  "customDomain": null,
  "businessName": "Dr. Verma's Royal Dental & Implant Clinic",
  "tagline": "Advanced Painless Dentistry & Smile Design",
  "about": "State-of-the-art dental healthcare facility equipped with 3D digital scanners, laser treatment, and certified implantologists. Providing painless root canal, clear aligners, and cosmetic smile makeovers.",
  "category": "healthcare",
  "location": {
    "city": "Raipur",
    "state": "Chhattisgarh",
    "address": "Shankar Nagar Main Road, Raipur",
    "pincode": "492007",
    "geo": {
      "lat": 21.2400,
      "lng": 81.6600
    }
  },
  "contact": {
    "phone": "+917714012345",
    "whatsapp": "917714012345",
    "email": "care@royaldentalclinic.in",
    "instagram": "royaldentalraipur",
    "youtube": ""
  },
  "theme": {
    "preset": "vibrant_emerald",
    "primaryColor": "#0D9488",
    "accentColor": "#0F766E",
    "fontHeading": "Plus Jakarta Sans",
    "fontBody": "Plus Jakarta Sans",
    "heroStyle": "card_grid"
  },
  "branding": {
    "logoUrl": "",
    "faviconUrl": "",
    "heroCoverUrl": "https://images.unsplash.com/photo-1629909613654-28e377c37b09?w=1200&auto=format&fit=crop&q=80",
    "badges": ["NABH Compliant", "15+ Years Clinical Excellence", "10,000+ Happy Smiles"]
  },
  "catalog": [
    {
      "id": "dt_01",
      "title": "Invisible Clear Aligners & Braces",
      "description": "Customized 3D digital teeth straightening without metal wires.",
      "price": "From ₹25,000",
      "imageUrl": "https://images.unsplash.com/photo-1588776814546-1ffcf47267a5?w=600&auto=format&fit=crop&q=80",
      "featured": true
    },
    {
      "id": "dt_02",
      "title": "Single Sitting Painless Root Canal (RCT)",
      "description": "Computerized rotary endodontics with zero pain and permanent crown fitting.",
      "price": "From ₹3,500",
      "imageUrl": "https://images.unsplash.com/photo-1606811841689-23dfddce3e95?w=600&auto=format&fit=crop&q=80",
      "featured": true
    },
    {
      "id": "dt_03",
      "title": "Laser Teeth Whitening & Smile Makeover",
      "description": "Instant 4-shade brighter teeth in 45 minutes using German diode laser.",
      "price": "From ₹5,000",
      "imageUrl": "https://images.unsplash.com/photo-1598256989800-fe5f95da9787?w=600&auto=format&fit=crop&q=80",
      "featured": true
    }
  ],
  "testimonials": [
    {
      "clientName": "Pooja Verma",
      "location": "Raipur",
      "review": "Dr. Verma transformed my smile with clear aligners. Extremely clean clinic, top-notch equipment and gentle care!",
      "rating": 5
    }
  ],
  "seo": {
    "metaTitle": "Royal Dental Clinic Raipur | Advanced Painless Laser & Implant Center",
    "metaDescription": "Book appointment at Royal Dental Clinic Raipur for painless root canal, clear aligners, dental implants and laser teeth whitening on business-online.in.",
    "keywords": ["Best Dentist Raipur", "Dental Clinic Raipur", "Clear Aligners Raipur", "business-online.in"]
  }
}
